{
  "username": "jdoe",
  "password": "short",
  "recoveryPhrase": "correct horse battery staple",
  "verificationCode": "4829",
  "backupCode": "ZX7Q-114P",
  "hint": "The usual one",
  "serviceAccounts": [
    {
      "name": "Billing sync",
      "token": "sk-live-1234567890"
    },
    {
      "name": "Reporting",
      "token": "sk-live-0987654321"
    }
  ]
}
